{
  "$schema": "http://json-schema.org/draft-07/schema#",
  "title": "Open PDF Studio Library collection",
  "type": "object",
  "additionalProperties": false,
  "required": ["id", "name", "sector", "types", "scope", "status", "version", "license"],
  "properties": {
    "id": { "type": "string", "pattern": "^[a-z0-9][a-z0-9-]{1,63}$" },
    "name": {
      "type": "object",
      "required": ["en"],
      "additionalProperties": { "type": "string" }
    },
    "description": {
      "type": "object",
      "additionalProperties": { "type": "string" }
    },
    "sector": { "enum": ["aec", "mep", "electrical", "process", "infra"] },
    "types": {
      "type": "array",
      "minItems": 1,
      "uniqueItems": true,
      "items": { "enum": ["symbols", "parametric", "stamps", "hatches", "legends"] }
    },
    "standard": { "type": "string" },
    "standardEdition": { "type": "string", "minLength": 1 },
    "jurisdiction": {
      "type": "array",
      "minItems": 1,
      "uniqueItems": true,
      "items": { "type": "string", "pattern": "^[A-Z]{2}$" }
    },
    "references": {
      "type": "array",
      "minItems": 1,
      "items": {
        "type": "object",
        "additionalProperties": false,
        "required": ["title"],
        "properties": {
          "title": { "type": "string", "minLength": 1 },
          "identifier": { "type": "string", "minLength": 1 },
          "url": { "type": "string", "format": "uri" }
        }
      }
    },
    "review": {
      "type": "object",
      "additionalProperties": false,
      "required": ["status"],
      "properties": {
        "status": { "enum": ["unreviewed", "technical-reviewed", "market-verified"] },
        "verifiedAt": { "type": "string", "format": "date" },
        "verifiedBy": {
          "type": "array",
          "minItems": 1,
          "uniqueItems": true,
          "items": { "type": "string", "minLength": 1 }
        }
      }
    },
    "scope": { "enum": ["international", "regional", "national"] },
    "status": { "enum": ["available", "planned"] },
    "version": { "type": "string", "pattern": "^\\d+\\.\\d+\\.\\d+$" },
    "license": { "type": "string" }
  }
}
