{
  "id": "gost-steel-shapes",
  "name": {
    "en": "Russian steel shapes (GOST)",
    "ru": "Прокат ГОСТ",
    "nl": "Russische staalprofielen (GOST)"
  },
  "description": {
    "en": "Cross-section and elevation symbols drawn from real section tables (fillets, centre lines). Includes a parametric size catalog (parametric.json) with real section tables; apps render sections from the table at true size.",
    "nl": "Doorsnede- en aanzichtsymbolen op echte tabelmaten (fillets, hartlijnen). Inclusief parametrische maatcatalogus (parametric.json) met echte tabelmaten; apps renderen doorsneden op ware grootte uit de tabel."
  },
  "sector": "aec",
  "types": [
    "symbols",
    "parametric"
  ],
  "standard": "GOST 8239",
  "scope": "national",
  "status": "available",
  "version": "1.1.0",
  "license": "repository"
}
