{
  "id": "tr-fire-symbols",
  "name": {
    "en": "Turkish fire safety plan symbols",
    "tr": "Yangın güvenliği plan sembolleri",
    "nl": "Turkse brandveiligheidssymbolen"
  },
  "types": [
    "symbols"
  ],
  "scope": "national",
  "sector": "aec",
  "license": "repository",
  "status": "planned",
  "version": "0.1.0"
}
