{
  "id": "uk-steel-sections",
  "name": {
    "en": "UK steel sections",
    "nl": "Britse staalprofielen"
  },
  "description": {
    "en": "Cross-section symbols for UK sections: UB, UC, PFC, RSA angles, tees, SHS/RHS/CHS, flat. Parametric sizing follows once the parametric format lands.",
    "nl": "Doorsnede-symbolen voor Britse profielen: UB, UC, PFC, RSA-hoekstaal, T, kokers/buis, strip. Parametrische maatvoering volgt zodra het parametrische formaat er is."
  },
  "sector": "aec",
  "types": [
    "symbols"
  ],
  "scope": "national",
  "status": "available",
  "version": "1.1.0",
  "license": "repository"
}
