{
  "id": "nen1414-fire",
  "name": {
    "en": "Fire safety drawing symbols (NEN 1414)",
    "nl": "Brandveiligheidssymbolen (NEN 1414)"
  },
  "sector": "aec",
  "types": [
    "symbols"
  ],
  "standard": "NEN 1414",
  "scope": "national",
  "status": "available",
  "version": "1.0.0",
  "license": "repository",
  "description": {
    "en": "Core set of Dutch fire safety drawing symbols (NEN 1414 terminology), drawn from scratch. The full legacy set from the app migrates here incrementally.",
    "nl": "Kernset Nederlandse brandveiligheidssymbolen (NEN 1414-terminologie), zelf getekend. De volledige set uit de app migreert hier stapsgewijs naartoe."
  }
}
