{
  "id": "gb-steel-shapes",
  "name": {
    "en": "Chinese steel shapes (GB)",
    "zh": "GB 型钢",
    "nl": "Chinese staalprofielen (GB)"
  },
  "description": {
    "en": "Cross-section and elevation symbols drawn from real section tables (fillets, centre lines). Parametric sizing follows once the parametric format lands.",
    "nl": "Doorsnede- en aanzichtsymbolen op echte tabelmaten (fillets, hartlijnen). Parametrische maatvoering volgt zodra het parametrische formaat er is."
  },
  "sector": "aec",
  "types": [
    "symbols"
  ],
  "standard": "GB/T 706",
  "scope": "national",
  "status": "available",
  "version": "1.0.0",
  "license": "repository"
}
