{
  "id": "iso7010-safety",
  "name": {
    "en": "Safety signs (ISO 7010)",
    "nl": "Veiligheidssignalering (ISO 7010)"
  },
  "sector": "aec",
  "types": ["symbols"],
  "standard": "ISO 7010",
  "scope": "international",
  "status": "available",
  "version": "1.0.0",
  "license": "repository"
}
