{
  "id": "aisc-steel-shapes",
  "name": {
    "en": "US steel shapes (AISC)",
    "nl": "Amerikaanse staalprofielen (AISC)"
  },
  "description": {
    "en": "Cross-section symbols for AISC shapes: W, S, HP, C, L, WT, HSS, pipe, plate. Parametric sizing (designation callouts) follows once the parametric format lands.",
    "nl": "Doorsnede-symbolen voor AISC-profielen: W, S, HP, C, L, WT, HSS, buis, plaat. Parametrische maatvoering volgt zodra het parametrische formaat er is."
  },
  "sector": "aec",
  "types": [
    "symbols"
  ],
  "standard": "AISC",
  "scope": "national",
  "status": "available",
  "version": "1.2.0",
  "license": "repository"
}
